<?xml version="1.0" encoding="UTF-8"?>    
<biblioteca_documentos xmlns:xsi="http://www.w3.org/2001/XMLSchema-instance" 
                       xsi:noNamespaceSchemaLocation= "biblioteca_documentos_2.xsd">

    <Libro libro_id="L-0001" tipo_clase="novela" num_paginas="70">
        <titulo> Viaje a Egipto</titulo>
        <capitulos>
            <capitulo>
                <titulo>Nos vamos</titulo>
            </capitulo>
            <contenido enlace="enlace"/> 
        </capitulos>
        <indice>Indice del libro</indice>
        <sinopsis>Sinopsis del libro</sinopsis>
    </Libro>
    
    <Libro libro_id="L-0002" tipo_clase="didáctico" num_paginas="77">
        <titulo> Aprendiendo XML</titulo>
        <capitulos>
            <capitulo>
                <titulo>Ya sabes. Eres un máquina</titulo>
            </capitulo>
            <contenido enlace="enlace"/> 
        </capitulos>
        <indice>Indice del libro</indice>
        <sinopsis>Sinopsis del libro</sinopsis>
    </Libro>
    

    <revista revista_id="R-0001" tipo_clase="coches" numero_paginas="25">
        <titulo>Revista coches</titulo>
        <numero_revista>3</numero_revista>
        <indice>Indice de la revista</indice>
        <seccion num_paginas_seccion="4">
            <titulo_seccion>Ferrari volador</titulo_seccion>
            <contenido enlace="enlace"/>
        </seccion>
    </revista>

    <revista revista_id="R-0002" tipo_clase="informática" numero_paginas="35">
        <titulo>Últimos avances con IA</titulo>
        <numero_revista>3</numero_revista>
        <indice>Indice de la revista</indice>
        <seccion num_paginas_seccion="4">
            <titulo_seccion>¿Qué puede hacer Chatgpt?</titulo_seccion>
            <contenido enlace="enlace"/>
        </seccion>
    </revista>


    <periodico periodico_id="P-0001" tipo_clase="nacional" fecha_publicacion="2023-05-12">
        <seccion tipo_seccion="deportes">
            <articulos nombre_autor="Sergio"/>
        </seccion>
        <indice> Indice del periódico</indice>
        <contenido enlace="enlace"/>
    </periodico>

    <periodico periodico_id="P-0002" tipo_clase="internacional" fecha_publicacion="2023-05-13">
        <seccion tipo_seccion="economia">
            <articulos nombre_autor="Pepito"/>
        </seccion>
        <indice> Indice del periódico</indice>
        <contenido enlace="enlace"/>
    </periodico>

</biblioteca_documentos>
